{
  "schema_version": "2.0",
  "decision_id": "illustrative-fallback-decision",
  "question_id": "Q1",
  "main_method_id": "median-slope-fallback",
  "baseline_method_id": "mean-baseline",
  "execution_role": "fallback",
  "rationale": "Structural example only. Runtime admission requires actual pinned main-trigger and fallback-screening evidence; NOT_RUN for this static example.",
  "evidence_refs": ["illustrative-main-probe", "illustrative-fallback-probe"],
  "decided_by": "agent",
  "actor_id": "illustrative-decision-agent",
  "decided_at": "2026-09-08T00:00:00Z",
  "human_event_id": null
}
