{"actor_id":"decision-agent","baseline_method_id":"mean-baseline","decided_at":"2026-09-08T00:00:00Z","decided_by":"agent","decision_id":"decision1","evidence_refs":["illustrative-probe"],"human_event_id":null,"main_method_id":"affine-main","question_id":"Q1","rationale":"Illustrative contract selection; runtime approval NOT_RUN.","schema_version":"2.0"}
